{
  "run_id": "APP-01-PILOTGLM-r1-i000",
  "task": "APP-01",
  "builder": "PILOTGLM",
  "repetition": 1,
  "iteration": 0,
  "started_utc": "2026-09-14T02:44:30Z",
  "finished_utc": "2026-09-14T02:47:48Z",
  "builder_platform": {
    "platform": "PILOTGLM",
    "tier": "unknown",
    "model_disclosed": null,
    "platform_version": null,
    "generation_mode": null,
    "settings": null
  },
  "env": {
    "node": "v24.19.0",
    "npm": "11.17.0",
    "python": "Python 3.12.14",
    "semgrep": "1.177.0",
    "playwright": "Version 1.63.0"
  },
  "dep_manifest_diff": null,
  "app_dir": "/home/z/my-project/VibeGuardBench/pilot/app-r1-i000",
  "checks": [
    {
      "check_id": "BUILD-001",
      "category": "BUILD",
      "outcome": "pass",
      "run_id": "APP-01-PILOTGLM-r1-i000",
      "iteration": 0,
      "observed": "exit 0",
      "expected": "exit 0",
      "detail": "sions may be purchased (at exorbitant rates) by contacting i@izs.me\nnpm warn allow-scripts 2 packages have install scripts not yet covered by allowScripts:\nnpm warn allow-scripts   bcrypt@5.1.1 (install: node-pre-gyp install --fallback-to-build)\nnpm warn allow-scripts   better-sqlite3@11.10.0 (install: prebuild-install || node-gyp rebuild --release)\nnpm warn allow-scripts\nnpm warn allow-scripts Run `npm approve-scripts --allow-scripts-pending` to review, or `npm approve-scripts <pkg>` to allow.\n",
      "tool": "npm"
    },
    {
      "check_id": "BUILD-002",
      "category": "BUILD",
      "outcome": "na",
      "run_id": "APP-01-PILOTGLM-r1-i000",
      "iteration": 0,
      "observed": "",
      "expected": "",
      "detail": "no build script declared",
      "tool": ""
    },
    {
      "check_id": "TYPE-001",
      "category": "TYPE",
      "outcome": "na",
      "run_id": "APP-01-PILOTGLM-r1-i000",
      "iteration": 0,
      "observed": "",
      "expected": "",
      "detail": "not a TypeScript project",
      "tool": ""
    },
    {
      "check_id": "LINT-001",
      "category": "LINT",
      "outcome": "pass",
      "run_id": "APP-01-PILOTGLM-r1-i000",
      "iteration": 0,
      "observed": "0 errors",
      "expected": "0 errors",
      "detail": "",
      "tool": "eslint"
    },
    {
      "check_id": "LINT-002",
      "category": "LINT",
      "outcome": "pass",
      "run_id": "APP-01-PILOTGLM-r1-i000",
      "iteration": 0,
      "observed": "0 warnings",
      "expected": "0 warnings",
      "detail": "",
      "tool": "eslint"
    },
    {
      "check_id": "SEC-001",
      "category": "SEC",
      "outcome": "pass",
      "run_id": "APP-01-PILOTGLM-r1-i000",
      "iteration": 0,
      "observed": "0 findings",
      "expected": "0 findings",
      "detail": "",
      "tool": "semgrep"
    },
    {
      "check_id": "SEC-002",
      "category": "SEC",
      "outcome": "pass",
      "run_id": "APP-01-PILOTGLM-r1-i000",
      "iteration": 0,
      "observed": "0 secret-pattern hits",
      "expected": "0",
      "detail": "",
      "tool": "secret-scan"
    },
    {
      "check_id": "SEC-003",
      "category": "SEC",
      "outcome": "fail",
      "run_id": "APP-01-PILOTGLM-r1-i000",
      "iteration": 0,
      "observed": "2 high/critical",
      "expected": "0 high/critical",
      "detail": "{\"info\": 0, \"low\": 0, \"moderate\": 2, \"high\": 1, \"critical\": 1, \"total\": 4}",
      "tool": "npm audit"
    },
    {
      "check_id": "BUILD-003",
      "category": "BUILD",
      "outcome": "pass",
      "run_id": "APP-01-PILOTGLM-r1-i000",
      "iteration": 0,
      "observed": "ok",
      "expected": "reachable on $PORT",
      "detail": "",
      "tool": "http"
    },
    {
      "check_id": "BUILD-004",
      "category": "BUILD",
      "outcome": "fail",
      "run_id": "APP-01-PILOTGLM-r1-i000",
      "iteration": 0,
      "observed": "GET / -> 404",
      "expected": "200 (or redirect to app UI)",
      "detail": "",
      "tool": "http"
    },
    {
      "check_id": "SEC-004",
      "category": "SEC",
      "outcome": "pass",
      "run_id": "APP-01-PILOTGLM-r1-i000",
      "iteration": 0,
      "observed": "none open",
      "expected": "none",
      "detail": "",
      "tool": "http-probe"
    },
    {
      "check_id": "FUNC-001",
      "category": "FUNC",
      "outcome": "fail",
      "run_id": "APP-01-PILOTGLM-r1-i000",
      "iteration": 0,
      "observed": "TimeoutError: locator.fill: Timeout 8000ms exceeded.",
      "expected": "",
      "detail": "",
      "tool": "playwright"
    },
    {
      "check_id": "FUNC-002",
      "category": "FUNC",
      "outcome": "fail",
      "run_id": "APP-01-PILOTGLM-r1-i000",
      "iteration": 0,
      "observed": "TimeoutError: locator.fill: Timeout 8000ms exceeded.",
      "expected": "",
      "detail": "",
      "tool": "playwright"
    },
    {
      "check_id": "FUNC-003",
      "category": "FUNC",
      "outcome": "fail",
      "run_id": "APP-01-PILOTGLM-r1-i000",
      "iteration": 0,
      "observed": "TimeoutError: locator.fill: Timeout 8000ms exceeded.",
      "expected": "",
      "detail": "",
      "tool": "playwright"
    },
    {
      "check_id": "FUNC-004",
      "category": "FUNC",
      "outcome": "fail",
      "run_id": "APP-01-PILOTGLM-r1-i000",
      "iteration": 0,
      "observed": "TimeoutError: locator.fill: Timeout 8000ms exceeded.",
      "expected": "",
      "detail": "",
      "tool": "playwright"
    },
    {
      "check_id": "FUNC-005",
      "category": "FUNC",
      "outcome": "na",
      "run_id": "APP-01-PILOTGLM-r1-i000",
      "iteration": 0,
      "observed": "",
      "expected": "",
      "detail": "not applicable to this task contract",
      "tool": ""
    },
    {
      "check_id": "FUNC-006",
      "category": "FUNC",
      "outcome": "fail",
      "run_id": "APP-01-PILOTGLM-r1-i000",
      "iteration": 0,
      "observed": "TimeoutError: locator.fill: Timeout 8000ms exceeded.",
      "expected": "",
      "detail": "",
      "tool": "playwright"
    },
    {
      "check_id": "FUNC-007",
      "category": "FUNC",
      "outcome": "fail",
      "run_id": "APP-01-PILOTGLM-r1-i000",
      "iteration": 0,
      "observed": "TimeoutError: locator.fill: Timeout 8000ms exceeded.",
      "expected": "",
      "detail": "",
      "tool": "playwright"
    },
    {
      "check_id": "FUNC-008",
      "category": "FUNC",
      "outcome": "fail",
      "run_id": "APP-01-PILOTGLM-r1-i000",
      "iteration": 0,
      "observed": "TimeoutError: locator.fill: Timeout 8000ms exceeded.",
      "expected": "",
      "detail": "",
      "tool": "playwright"
    },
    {
      "check_id": "FUNC-009",
      "category": "FUNC",
      "outcome": "fail",
      "run_id": "APP-01-PILOTGLM-r1-i000",
      "iteration": 0,
      "observed": "TimeoutError: locator.fill: Timeout 8000ms exceeded.",
      "expected": "",
      "detail": "",
      "tool": "playwright"
    },
    {
      "check_id": "FUNC-010",
      "category": "FUNC",
      "outcome": "fail",
      "run_id": "APP-01-PILOTGLM-r1-i000",
      "iteration": 0,
      "observed": "TimeoutError: locator.fill: Timeout 8000ms exceeded.",
      "expected": "",
      "detail": "",
      "tool": "playwright"
    },
    {
      "check_id": "FUNC-011",
      "category": "FUNC",
      "outcome": "pass",
      "run_id": "APP-01-PILOTGLM-r1-i000",
      "iteration": 0,
      "observed": "",
      "expected": "",
      "detail": "",
      "tool": "playwright"
    },
    {
      "check_id": "AUTHZ-004",
      "category": "AUTHZ",
      "outcome": "fail",
      "run_id": "APP-01-PILOTGLM-r1-i000",
      "iteration": 0,
      "observed": "TimeoutError: locator.fill: Timeout 8000ms exceeded.",
      "expected": "",
      "detail": "",
      "tool": "playwright"
    },
    {
      "check_id": "A11Y-001",
      "category": "A11Y",
      "outcome": "pass",
      "run_id": "APP-01-PILOTGLM-r1-i000",
      "iteration": 0,
      "observed": "",
      "expected": "",
      "detail": "",
      "tool": "playwright"
    },
    {
      "check_id": "A11Y-002",
      "category": "A11Y",
      "outcome": "fail",
      "run_id": "APP-01-PILOTGLM-r1-i000",
      "iteration": 0,
      "observed": "TimeoutError: locator.fill: Timeout 8000ms exceeded.",
      "expected": "",
      "detail": "",
      "tool": "playwright"
    },
    {
      "check_id": "A11Y-003",
      "category": "A11Y",
      "outcome": "fail",
      "run_id": "APP-01-PILOTGLM-r1-i000",
      "iteration": 0,
      "observed": "TimeoutError: locator.fill: Timeout 8000ms exceeded.",
      "expected": "",
      "detail": "",
      "tool": "playwright"
    },
    {
      "check_id": "A11Y-004",
      "category": "A11Y",
      "outcome": "pass",
      "run_id": "APP-01-PILOTGLM-r1-i000",
      "iteration": 0,
      "observed": "",
      "expected": "",
      "detail": "",
      "tool": "playwright"
    },
    {
      "check_id": "BUILD-005",
      "category": "BUILD",
      "outcome": "pass",
      "run_id": "APP-01-PILOTGLM-r1-i000",
      "iteration": 0,
      "observed": "clean",
      "expected": "no fatal startup errors",
      "detail": "",
      "tool": "engine.mjs"
    },
    {
      "check_id": "AUTHZ-001",
      "category": "AUTHZ",
      "outcome": "pass",
      "run_id": "APP-01-PILOTGLM-r1-i000",
      "iteration": 0,
      "observed": "all denied",
      "expected": "401/403/redirect on all protected paths",
      "detail": "",
      "tool": "engine.mjs"
    },
    {
      "check_id": "AUTHZ-002",
      "category": "AUTHZ",
      "outcome": "pass",
      "run_id": "APP-01-PILOTGLM-r1-i000",
      "iteration": 0,
      "observed": "all 200",
      "expected": "200 for allowed role/path pairs",
      "detail": "",
      "tool": "engine.mjs"
    },
    {
      "check_id": "AUTHZ-003",
      "category": "AUTHZ",
      "outcome": "pass",
      "run_id": "APP-01-PILOTGLM-r1-i000",
      "iteration": 0,
      "observed": "all 403",
      "expected": "403 for every deny-matrix probe",
      "detail": "",
      "tool": "engine.mjs"
    },